{
  "id": "2025-06-29-sovereign-debt-hard-assets",
  "date": "2025-06-29",
  "category": "macro",
  "references": [
    "https://cryptohayes.medium.com/",
    "IMF Global Debt Monitor",
    "Federal Reserve Economic Data on Government Debt",
    "Bank for International Settlements Debt Statistics"
  ],
  "languages": {
    "ja-JP": {
      "title": "主権債務危機：なぜ各国政府が「ハード資産」を再考し始めているのか",
      "content": "今日は多くの人が見過ごしがちだが、私たち一人一人の財布に影響を与える可能性のある話題について話しましょう：世界的な政府債務危機です。\n\nまず、いくつかの数字を見てみましょう：米国政府の債務はすでにGDPの120%を超え、日本は260%にも達し、ヨーロッパの主要国も90%を普遍的に超えています。これらの数字は何を意味するのでしょうか？各国政府の財政余地が急速に縮小していることを意味します。\n\nさらに重要なのは、今回は過去の債務危機とは異なることです。過去、政府は経済成長によって債務を希薄化できましたが、現在各国は人口高齢化と生産性向上の鈍化という問題に直面しています。簡単に言えば、お金を稼ぐ速度が借金の速度に追いつかないということです。\n\nでは政府はどうするでしょうか？歴史は通常、答えは紙幣を印刷することだと教えています。しかし今回の印刷方法はより隠密になる可能性があります。中央銀行は長期間低金利を維持し、政府が非常に低いコストで借金できるようにするかもしれません。これが経済学者の言う「金融抑制」です——人為的に金利を抑制して債務負担を軽減することです。\n\n問題は、金融抑制の代償は何かということです。現金や債券を保有する人の購買力がゆっくりと侵食されることです。銀行にお金を預けても、金利はインフレにも勝てない可能性があります。これが、ますます多くの機関投資家が「ハード資産」の配分を始めている理由です。\n\nハード資産とは何でしょうか？政府が自由に印刷できない資産のことです。金は最も伝統的なハード資産ですが、ビットコインはデジタル時代の新しい選択肢になりつつあります。その供給量は固定されており、政府の財政圧力によって増加することはありません。\n\n最も興味深いのは、一部の国の政府もこの論理を考慮し始めていることです。エルサルバドルがビットコインを法定通貨にした理由の一部は、ドルの下落圧力に対抗することを望んだからです。この実験はまだ進行中ですが、重要な問題を提起しています：主権債務危機の時代において、政府自身も国家財産を保護するためにハード資産が必要なのでしょうか？\n\n投資の観点から、この傾向の意味は明確です。政府がより多くの金融抑制政策を実施せざるを得ない場合、伝統的な固定収益投資は長期的な実質マイナス収益に直面する可能性があります。逆に、希少性資産——金であれ、ビットコインであれ、優良な株式資産であれ——はこのような環境から恩恵を受ける可能性があります。\n\nもちろん、このプロセスは線形ではありません。政府は、より厳格な資本規制や税制政策を含む様々な方法で既存システムを維持しようとするでしょう。しかし長期的に見れば、数学は冷酷です：債務成長が経済成長を超える時、必ず誰かが代価を払わなければなりません。\n\n重要なのは、私たちが「ハード資産がソフト資産より優れる」時代に入りつつある可能性があることを理解することです。この時代において、希少性は単なる投資理念ではなく、システムリスクに対抗するための必需品なのです。"
    }
  },
  "metadata": {
    "translation_status": {
      "source_language": "zh-TW",
      "source_reviewed": true,
      "translated_to": [
        "ja-JP"
      ],
      "translated_at": "2025-06-29T07:43:10.158Z"
    },
    "tts": {
      "ja-JP": {
        "status": "completed",
        "audio_url": "https://drive.google.com/file/d/1Kcsn6vMeWBADlzkG66sNJCIMXzrhwGn1/view",
        "voice_config": {
          "languageCode": "ja-JP",
          "name": "ja-JP-Wavenet-C",
          "folderId": "1KJ1WHnnFtsafzsrWuK6S3S8Atym5lVDs"
        }
      }
    },
    "created_at": "2025-06-29T07:43:10.158Z",
    "updated_at": "2025-06-29T08:04:54.532Z"
  }
}