{
  "id": "2025-06-29-sovereign-debt-hard-assets",
  "date": "2025-06-29",
  "category": "macro",
  "references": [
    "https://cryptohayes.medium.com/",
    "IMF Global Debt Monitor",
    "Federal Reserve Economic Data on Government Debt",
    "Bank for International Settlements Debt Statistics"
  ],
  "languages": {
    "zh-TW": {
      "title": "主權債務危機：為什麼各國政府開始重新考慮「硬資產」",
      "content": "今天來聊一個很多人忽視，但卻可能影響我們每個人錢包的話題：全球政府債務危機。\n\n先看幾個數字：美國政府債務已經超過GDP的120%，日本更是高達260%，就連歐洲主要國家也普遍超過90%。這些數字意味著什麼？意味著各國政府的財政空間正在快速縮小。\n\n更關鍵的是，這次不同於以往的債務危機。過去政府可以通過經濟增長來稀釋債務，但現在各國都面臨著人口老齡化和生產力增長放緩的問題。簡單說，就是賺錢的速度追不上欠錢的速度。\n\n那政府會怎麼辦？歷史告訴我們，答案通常是印鈔票。但這次印鈔的方式可能更加隱蔽。央行可能會長期保持低利率，讓政府能夠以很低的成本借錢。這就是經濟學家說的「金融抑制」——通過人為壓低利率來減輕債務負擔。\n\n問題是，金融抑制的代價是什麼？是持有現金和債券的人的購買力被慢慢侵蝕。如果你把錢存在銀行，利率可能連通脹都跑不贏。這就是為什麼我們看到越來越多的機構投資者開始配置「硬資產」。\n\n什麼是硬資產？就是那些不能被政府隨意印出來的資產。黃金是最傳統的硬資產，但比特幣正在成為數位時代的新選擇。它的供應量是固定的，不會因為政府的財政壓力而增加。\n\n最有趣的是，我們開始看到一些國家政府也在考慮這個邏輯。薩爾瓦多將比特幣作為法定貨幣，部分原因就是希望對抗美元的貶值壓力。雖然這個實驗還在進行中，但它提出了一個重要問題：在主權債務危機的時代，政府本身是否也需要硬資產來保護國家財富？\n\n從投資角度來看，這個趨勢的含義很清楚。如果政府被迫實施更多的金融抑制政策，那麼傳統的固定收益投資可能會面臨長期的實質負收益。相反，稀缺性資產——無論是黃金、比特幣，還是優質的股權資產——可能會受益於這種環境。\n\n當然，這個過程不會是線性的。政府會試圖通過各種方式來維持現有體系，包括更嚴格的資本管制和稅收政策。但長期來看，數學是無情的：當債務增長超過經濟增長時，總要有人買單。\n\n關鍵是要理解，我們可能正在進入一個「硬資產優於軟資產」的時代。在這個時代，稀缺性不只是投資理念，更是對抗系統性風險的必需品。"
    }
  },
  "metadata": {
    "translation_status": {
      "source_language": "zh-TW",
      "source_reviewed": true,
      "translated_to": [
        "en-US",
        "ja-JP"
      ],
      "rejection": {
        "rejected": false,
        "reason": "",
        "timestamp": ""
      }
    },
    "tts": {
      "zh-TW": {
        "status": "pending",
        "audio_url": null,
        "voice_config": {
          "languageCode": "cmn-TW",
          "name": "cmn-TW-Wavenet-A"
        }
      }
    },
    "created_at": "2025-06-29T00:00:00Z",
    "updated_at": "2025-06-29T07:43:10.160Z"
  }
}