{
  "id": "2025-06-29-dedollarization-brics-crypto",
  "date": "2025-06-29",
  "category": "macro",
  "references": [
    "https://cryptohayes.medium.com/",
    "BRICS+ Joint Declarations on Alternative Payment Systems",
    "IMF Reports on Reserve Currency Diversification",
    "Federal Reserve Research on Dollar Dominance"
  ],
  "languages": {
    "zh-TW": {
      "title": "去美元化加速：BRICS+如何用數位資產重寫全球貿易規則",
      "content": "最近有個新聞可能沒引起太多關注，但卻可能改變世界經濟格局：BRICS+國家正在加速建立不依賴美元的貿易結算系統。而加密貨幣，正在其中扮演關鍵角色。\n\n先說個數字：目前全球貿易中，超過60%仍然使用美元結算。但這個比例正在快速下降。俄羅斯因為制裁，已經將對中國的貿易幾乎全部轉為人民幣和盧布結算。印度在購買俄羅斯石油時，也繞過了美元系統。\n\n為什麼會這樣？因為美元霸權的代價越來越高。每次美國實施金融制裁，其他國家就更加意識到：把命運交給別人的貨幣系統，是多麼危險的事情。\n\n這就是數位資產的機會窗口。傳統的去美元化面臨一個問題：替代的法幣系統仍然需要複雜的銀行基礎設施。但數位資產不一樣，它可以直接在國家之間流通，不需要經過傳統的銀行中介。\n\n更有趣的是，我們看到一些國家開始探索「數位資產籃子」的概念。不是依賴單一貨幣，而是用一籃子包含比特幣、黃金和主要貨幣的數位資產來進行國際結算。這既避免了對單一國家貨幣的依賴，也利用了數位資產的技術優勢。\n\n從宏觀經濟的角度看，這個趨勢不可逆轉。美國雖然仍然是全球最大經濟體，但其GDP在全球的占比已經從二戰後的50%下降到現在的25%左右。經濟實力的相對下降，必然伴隨著貨幣影響力的削弱。\n\n對投資者來說，這意味著什麼？首先，美元的長期走勢可能面臨結構性壓力。其次，那些能夠在新的多極化貨幣體系中發揮作用的資產——包括比特幣、黃金，以及主要新興市場貨幣——可能會受益。\n\n但要注意，這個過程不會一蹴而就。美元系統建立了70多年，有著深厚的網絡效應和慣性。去美元化更像是一個漸進的過程，而不是突然的崩潰。\n\n關鍵是要理解，我們正在見證一個歷史性的轉變：從單極貨幣體系向多極貨幣體系的演進。而在這個過程中，數位資產可能會成為新舊體系之間的橋樑。"
    }
  },
  "metadata": {
    "translation_status": {
      "source_language": "zh-TW",
      "source_reviewed": true,
      "translated_to": [],
      "rejection": {
        "rejected": false,
        "reason": "",
        "timestamp": ""
      }
    },
    "tts": {
      "zh-TW": {
        "status": "pending",
        "audio_url": null,
        "voice_config": {
          "languageCode": "cmn-TW",
          "name": "cmn-TW-Wavenet-A"
        }
      }
    },
    "created_at": "2025-06-29T00:00:00Z",
    "updated_at": "2025-06-29T00:00:00Z"
  }
}