{
  "id": "2025-06-29-unichain-defi-revolution",
  "date": "2025-06-29",
  "category": "ethereum",
  "references": [
    "https://www.coindesk.com/tech/2025/02/10/uniswap-labs-officially-launches-layer-2-unichain",
    "https://blog.uniswap.org/introducing-unichain",
    "https://www.21shares.com/en-us/research/newsletter-issue-246"
  ],
  "languages": {
    "en-US": {
      "title": "Unichain Revolution: DeFi's New Home Officially Launches",
      "content": "Friends, today let's talk about a major event that will change the DeFi game: Uniswap's Unichain has officially gone live!\n\nImagine needing several days for a traditional bank transfer, with expensive fees to boot. Now, Unichain has slashed Ethereum transaction fees by 95%, with transaction speeds so fast they take only 250 milliseconds. What does that mean? It's faster than you can blink!\n\nIt's like transforming a congested highway into a super high-speed rail designed specifically for financial transactions. Uniswap used Optimism's OP Stack technology to create a high-speed lane custom-built for DeFi.\n\nMost interestingly, Unichain isn't just fastâ€”it also solves a problem that has long plagued DeFi: fragmented liquidity. Previously, trading across different chains was as troublesome as transferring between different banks. Now Unichain aims to become the \"home of cross-chain liquidity,\" consolidating all assets into one deep market.\n\nThe UNI token has also undergone a magnificent transformation, evolving from a simple governance token into a utility token. UNI holders can now participate in network validation and earn a share of transaction fees. It's like going from being a shareholder to becoming a partner actively involved in operations.\n\nWhat does this mean for us regular users? Cheaper transaction fees, faster transaction speeds, and better cross-chain experiences. DeFi is becoming more like the financial services we're used to, while maintaining the advantages of decentralization.\n\nThis isn't just a technical upgradeâ€”it's a major evolution in DeFi infrastructure. Unichain's success could trigger the emergence of more specialized Layer 2 solutions, opening a new chapter for the entire Ethereum ecosystem."
    }
  },
  "metadata": {
    "translation_status": {
      "source_language": "zh-TW",
      "source_reviewed": true,
      "translated_to": [
        "en-US"
      ],
      "translated_at": "2025-06-29T07:19:38.424Z"
    },
    "tts": {
      "en-US": {
        "status": "pending",
        "audio_url": null,
        "voice_config": {
          "languageCode": "en-US",
          "name": "en-US-Wavenet-D",
          "folderId": "1MkzZPY2iu09smRAwzGwXXG5_-hUDCVLw",
          "socialPrefix": "ðŸš€",
          "hookLength": 150
        }
      }
    },
    "created_at": "2025-06-29T07:19:38.426Z",
    "updated_at": "2025-06-29T07:19:38.426Z"
  }
}