{
  "id": "2025-06-29-blackrock-bitcoin-institutional-adoption",
  "date": "2025-06-29",
  "category": "daily-news",
  "references": [
    "BlackRock 比特幣 ETF 投資報告",
    "美國 ETF 資金流向數據",
    "機構投資者加密貨幣採納趨勢研究"
  ],
  "languages": {
    "zh-TW": {
      "title": "全球最大資產管理公司狂買比特幣：這對你的投資組合意味著什麼？",
      "content": "嗨，今天我想跟你聊一件很有意思的事情。你知道全球最大的資產管理公司 BlackRock 嗎？就是那個管理著超過 10 萬億美金的巨無霸公司。\n\n最新消息是，他們這週又買了 11.5 億美金的比特幣！而且這還不是個案，整個比特幣 ETF 市場這週流入了 5.01 億美金，以太坊 ETF 也有 7740 萬美金流入。\n\n這到底意味著什麼？\n\n你想想看，BlackRock 不是什麼投機的散戶，他們是全世界最保守、最專業的機構投資者之一。他們管理的錢來自全球的退休基金、保險公司、政府主權基金。這些錢的主人可都不是開玩笑的。\n\n當這樣的機構開始大量買入比特幣時，它傳遞了一個很重要的信號：比特幣正在從「投機工具」變成「合法資產」。\n\n為什麼機構投資者現在才進場？\n\n其實答案很簡單：監管環境變了。\n\n以前，像 BlackRock 這樣的機構想買比特幣，但是沒有合規的管道。他們不能直接去交易所買，因為監管風險太大。客戶也不放心把錢交給他們去投資一個「不受監管」的資產。\n\n但是現在有了比特幣 ETF，情況完全不同了。ETF 是受美國證券交易委員會監管的正規金融產品。機構投資者可以像買股票一樣買比特幣 ETF，風險控制、合規要求都有明確的框架。\n\n這對普通投資者意味著什麼？\n\n首先，這是一個市場成熟的信號。當全世界最專業的投資者都開始配置比特幣時，這說明比特幣作為資產類別的地位得到了認可。\n\n其次，這可能會影響比特幣的價格穩定性。機構投資者通常採用長期配置策略，不像散戶那樣頻繁買賣。他們的進入可能會減少市場的劇烈波動。\n\n但是，這也帶來了新的風險考量。\n\n新的風險是什麼？\n\n當比特幣越來越「機構化」，它可能會失去一些原本的特質。比如說，它可能會跟傳統金融市場的相關性增加。以前比特幣被認為是一種「另類投資」，可以在股市下跌時提供保護。但如果機構投資者把它當作風險資產來配置，那麼在市場恐慌時，它可能也會跟股票一起下跌。\n\n另外，機構的進入也意味著監管會更加嚴格。政府會更關注這個市場，可能會出台更多的規定。這對市場的發展是好事，但也可能限制某些創新。\n\n對你的投資決策有什麼啟發？\n\n如果你之前對比特幣還猶豫不決，機構投資者的大量進入可能是一個重要的參考信號。但這不代表你應該盲目跟風。\n\n我的建議是：\n\n第一，把比特幣當作資產配置的一部分，而不是全部。即使是 BlackRock，比特幣在他們整個投資組合中的比例也很小。\n\n第二，要有長期思維。機構投資者買比特幣不是為了快速賺錢，而是為了長期的資產配置多樣化。如果你也想參與，最好有同樣的心態。\n\n第三，要理解風險。雖然機構的進入讓比特幣看起來更「安全」了，但它仍然是一個高風險、高波動的資產。\n\n更大的趨勢\n\n我覺得這個消息反映了一個更大的趨勢：數位資產正在成為全球金融體系的一部分。\n\n你想想，十年前如果有人跟你說，未來全世界最大的資產管理公司會把客戶的錢投資到一個叫比特幣的數位貨幣上，你一定覺得這個人瘋了。但現在這就是現實。\n\n這個變化不只是關於比特幣，它代表著整個金融業對新技術、新資產類別的態度轉變。區塊鏈技術、數位資產，這些原本被認為是「邊緣」的東西，正在走向主流。\n\n最後的思考\n\n我想說，無論你是否投資比特幣，這個趨勢都值得關注。因為它不只是一個投資機會，更是一個時代變革的標誌。\n\n當像 BlackRock 這樣的機構開始認真對待數位資產時，這意味著我們正在見證金融業的一次歷史性轉變。這個轉變會如何影響未來的投資環境、金融服務，甚至是整個經濟體系，都值得我們持續觀察。\n\n不管怎樣，有一點是確定的：數位資產已經不再是小眾的遊戲了。它正在成為全球金融體系的重要組成部分。你準備好了嗎？"
    }
  },
  "metadata": {
    "translation_status": {
      "source_language": "zh-TW",
      "source_reviewed": true,
      "translated_to": [
        "en-US"
      ],
      "rejection": {
        "rejected": true,
        "reason": "有點普通，感覺我沒學到什麼東西",
        "reviewer": "",
        "timestamp": "2025-06-29T03:49:52.111Z"
      }
    },
    "tts": {
      "zh-TW": {
        "status": "pending",
        "audio_url": null,
        "voice_config": {
          "languageCode": "zh-TW",
          "name": "cmn-TW-Wavenet-A"
        }
      }
    },
    "created_at": "2025-06-29T00:00:00Z",
    "updated_at": "2025-06-29T07:17:50.650Z"
  }
}