{
  "id": "2025-06-29-restaking-ecosystem-analysis",
  "date": "2025-06-29",
  "category": "ethereum",
  "references": [
    "https://www.eigenlayer.xyz/",
    "https://docs.eigenlayer.xyz/eigenlayer/overview/",
    "https://defillama.com/protocols/Liquid%20Restaking"
  ],
  "languages": {
    "ja-JP": {
      "title": "リステーキング1年間の観察：イーサリアムセキュリティの「諸刃の剣」効果",
      "content": "皆さん、今日はイーサリアムの経済モデルを再構築している重要なイノベーション、リステーキング（Restaking）について深く分析していきましょう。1年以上の発展を経て、この概念は実験的なアイデアから数百億ドルの資産を持つ重要なインフラストラクチャーへと変化しました。\n\nまずリステーキングとは何かを説明しましょう。家を銀行に担保に入れて車のローンを組み、同時にその車のローンを担保にしてクレジットカードを申し込むことを想像してみてください。リステーキングも似たような概念です：同じETHを使ってイーサリアムメインネットと他のサービスの両方にセキュリティ保証を提供し、複数の収益を得ますが、同時に複数のリスクも負うことになります。\n\nこの一見複雑な金融イノベーションは、根本的な問題を解決しています：新しいブロックチェーンサービスはどのようにして十分なセキュリティを獲得するのか？以前は、各新規プロジェクトが独自のトークンを発行し、独自のバリデータネットワークを構築する必要があり、コストが高く効率も悪いものでした。今では、イーサリアムのセキュリティを「レンタル」することができます。\n\nデータによると、現在リステーキングプロトコルには150億ドル以上のETHがロックされており、これはイーサリアム総ステーキング量の約15％に相当します。トップクラスのプロトコルであるEigenLayerは、すでに数十の異なるサービスをサポートしており、分散型オラクルからクロスチェーンブリッジ、データ可用性レイヤーから分散型シーケンサーまで幅広く対応しています。\n\nこのようなイノベーションは収益の大幅な向上をもたらしました。通常のETHステーキングの年利は約3-4％ですが、リステーキングに参加するユーザーは6-8％またはそれ以上の収益を得ることができます。大手機関にとって、この追加収益は非常に魅力的です。\n\nしかし、コインには必ず裏表があります。リステーキングのリスクも蓄積し続けています。あるサービスで重大な障害が発生したり攻撃を受けたりした場合、リステーキングに参加しているETHが大量にスラッシングされる可能性があります。さらに懸念されるのは、複数のサービスが同時に問題を起こした場合、連鎖反応を引き起こし、イーサリアムネットワーク全体の安定性を脅かす可能性があることです。\n\n市場パフォーマンスの観点から見ると、リステーキングはすでにDeFi利回りの新しい「ベンチマーク」となっています。多くの従来の流動性マイニングプロジェクトは、利回りがリステーキングより低い場合、資金を引き付けることが困難であることを発見しています。この「利回り軍拡競争」はDeFiのリスク・リターン構造を再定義しています。\n\nより深い影響はガバナンスレベルにあります。大量のETHが少数のリステーキングプロトコルに集中することで、イーサリアムの分散化度に影響を与える可能性があります。これらのプロトコルの運営者が不適切な決定を下した場合、その影響範囲は単一プロジェクトを大きく超えることになります。\n\n技術レベルでのイノベーションも継続しています。最新のリステーキングプロトコルは「リスク階層化」メカニズムの導入を開始し、ユーザーが異なるリスクレベルのサービス組み合わせを選択できるようにしています。一部のプロトコルでは「保険」メカニズムの探索も行っており、リステーキング参加者に追加のリスク保護を提供しています。\n\n長期的に見ると、リステーキングは全く新しい「セキュリティ市場」を生み出す可能性があります。異なるリスクレベルのサービスには異なる「セキュリティ価格」が設定され、より精密なリスク管理システムが形成されるでしょう。\n\nこのイノベーションは私たちに警鐘を鳴らしています：より高い収益を追求する一方で、システミックリスクの蓄積を無視してはいけません。リステーキングはイーサリアムエコシステムの繁栄の表れでもあり、同時に継続的に監視すべき潜在的リスクポイントでもあります。賢明な投資家は機会とリスクの間でバランスを見つけるでしょう。"
    }
  },
  "metadata": {
    "translation_status": {
      "source_language": "zh-TW",
      "source_reviewed": true,
      "translated_to": [
        "ja-JP"
      ],
      "translated_at": "2025-06-29T07:41:37.005Z"
    },
    "tts": {
      "ja-JP": {
        "status": "pending",
        "audio_url": null,
        "voice_config": {
          "languageCode": "ja-JP",
          "name": "ja-JP-Wavenet-C",
          "folderId": "1KJ1WHnnFtsafzsrWuK6S3S8Atym5lVDs"
        }
      }
    },
    "created_at": "2025-06-29T07:41:37.005Z",
    "updated_at": "2025-06-29T07:41:37.005Z"
  }
}