{
  "id": "2025-06-29-restaking-ecosystem-analysis",
  "date": "2025-06-29",
  "category": "ethereum",
  "references": [
    "https://www.eigenlayer.xyz/",
    "https://docs.eigenlayer.xyz/eigenlayer/overview/",
    "https://defillama.com/protocols/Liquid%20Restaking"
  ],
  "languages": {
    "zh-TW": {
      "title": "重質押一年觀察：以太坊安全性的「雙刃劍」效應",
      "content": "各位朋友，今天我們來深入分析一個正在重塑以太坊經濟模式的重要創新：重質押（Restaking）。經過一年多的發展，這個概念已經從實驗性想法變成了擁有數百億美元資產的重要基礎設施。\n\n先解釋一下重質押是什麼。想像你把房子抵押給銀行貸款買車，同時又把這筆車貸當作擔保去申請信用卡。重質押就是類似的概念：你用同一批ETH同時為以太坊主網和其他服務提供安全保證，獲得多重收益，但也承擔多重風險。\n\n這個看似複雜的金融創新，解決了一個根本性問題：新的區塊鏈服務如何獲得足夠的安全性？以前，每個新項目都需要發行自己的代幣、建立自己的驗證者網絡，成本高昂且效率低下。現在，它們可以「租用」以太坊的安全性。\n\n數據顯示，目前重質押協議中鎖定了超過150億美元的ETH，這相當於以太坊總質押量的約15%。EigenLayer作為龍頭協議，已經支援了數十個不同的服務，從去中心化預言機到跨鏈橋，從數據可用性層到去中心化排序器。\n\n這種創新帶來了顯著的收益提升。普通的ETH質押年化收益率約為3-4%，而參與重質押的用戶可以獲得6-8%甚至更高的收益。對於大型機構來說，這種額外收益極具吸引力。\n\n但硬幣總有兩面。重質押的風險也在不斷累積。如果某個服務出現嚴重故障或遭到攻擊，參與重質押的ETH可能被大量削減（Slashing）。更令人擔憂的是，如果多個服務同時出問題，可能引發連鎖反應，威脅整個以太坊網絡的穩定性。\n\n從市場表現看，重質押已經成為DeFi收益率的新「基準」。許多傳統的流動性挖礦項目發現，如果收益率低於重質押，很難吸引資金。這種「收益率軍備競賽」正在重新定義DeFi的風險回報結構。\n\n更深層的影響在於治理層面。大量ETH集中在少數重質押協議中，可能會影響以太坊的去中心化程度。如果這些協議的運營商做出不當決策，影響範圍將遠超單一項目。\n\n技術層面的創新也在持續。最新的重質押協議開始引入「風險分級」機制，讓用戶可以選擇風險程度不同的服務組合。一些協議還在探索「保險」機制，為重質押者提供額外的風險保護。\n\n從長遠看，重質押可能會催生一個全新的「安全性市場」。不同風險等級的服務將有不同的「安全性定價」，形成一個更加精細化的風險管理體系。\n\n這個創新提醒我們：在追求更高收益的同時，不能忽視系統性風險的積累。重質押既是以太坊生態系統繁榮的體現，也是我們需要持續監控的潛在風險點。智慧的投資者會在機會和風險之間找到平衡。"
    }
  },
  "metadata": {
    "translation_status": {
      "source_language": "zh-TW",
      "source_reviewed": true,
      "translated_to": [
        "en-US"
      ],
      "rejection": {
        "rejected": false,
        "reason": "",
        "timestamp": ""
      }
    },
    "tts": {
      "zh-TW": {
        "status": "pending",
        "audio_url": null
      }
    },
    "created_at": "2025-06-29T10:40:00.000Z",
    "updated_at": "2025-06-29T07:19:15.686Z"
  }
}