{
  "id": "2024-12-29-fed-rate-cut-crypto-impact",
  "date": "2024-12-29",
  "category": "daily-news",
  "references": [
    "CNBC - Bitcoin rises to new record above $107,000 ahead of this week's Fed decision",
    "Reuters - Crypto market eyes interest rates and expected bitcoin ETFs in 2024",
    "Crypto Briefing - Fed cuts rates by 25 basis points as crypto market extends losses",
    "Mudrex Learn - Dec 19 2024 Fed Rate Cut: What To Expect For Crypto"
  ],
  "languages": {
    "zh-TW": {
      "title": "聯準會降息了，你的加密貨幣投資為什麼反而下跌？",
      "content": "你有沒有想過，為什麼聯準會降息這個看起來的好消息，卻讓你的比特幣投資帳戶變綠了？\n\n12月18日，美國聯邦儲備理事會宣布降息25個基點，將基準利率調降至4.25%到4.5%之間。這是今年第三次連續降息，也是自2022年12月以來的最低水準。按理說，降息應該讓錢變得更便宜，投資人更願意把錢投入風險較高的資產，比如加密貨幣。\n\n但現實卻給了我們一個耳光。比特幣在聯準會宣布後下跌了4%，以太坊和Solana的跌幅更大，分別下跌5%和6%。24小時內，整個加密貨幣市場出現了6.75億美元的清算，其中比特幣和以太坊的多頭清算都超過了1億美元。\n\n這到底是怎麼回事？\n\n其實，市場已經提前消化了這次降息的預期。真正讓投資人緊張的，是聯準會主席鮑爾在記者會上透露的訊息：2025年可能只會降息兩次，而不是之前預期的更多次。\n\n想像一下，你本來以為明年會有更多降息機會，突然被告知機會比預期少，你會怎麼反應？就像你本來計畫用低利率貸款投資，突然發現貸款成本可能比想像中高，當然會重新考慮投資計畫。\n\n更重要的是，川普即將上任的政策不確定性也在攪動市場。他提出的關稅政策和移民政策可能會推高通脹，這會讓聯準會在降息時更加謹慎。市場開始擔心，如果通脹再次抬頭，聯準會可能要重新考慮寬鬆的貨幣政策。\n\n但從另一個角度看，這次下跌可能只是短期調整。比特幣今年的表現依然亮眼：12月份上漲9%，自美國總統大選以來上漲52%，整年漲幅高達149%。更重要的是，它在12月創下了107,229美元的歷史新高。\n\n為什麼比特幣今年表現這麼好？主要有三個原因：\n\n首先，比特幣現貨ETF的推出為市場帶來了大量資金流入。這讓傳統投資人可以更容易地投資比特幣，不需要直接持有加密貨幣。\n\n其次，川普勝選後承諾建立對加密貨幣更友善的監管環境，甚至可能建立國家戰略比特幣儲備。這種政策預期推動了所謂的「川普交易」。\n\n最後，全球經濟不確定性讓更多人把比特幣視為類似黃金的避險資產。當傳統投資變得風險更高時，一些投資人開始把比特幣當作投資組合的一部分。\n\n那麼，對於普通投資人來說，現在應該怎麼辦？\n\n首先，不要被短期波動嚇到。加密貨幣市場的波動性本來就很大，一天下跌5%在這個市場算是正常現象。\n\n其次，要關注長期趨勢而不是短期新聞。聯準會的政策確實會影響加密貨幣，但這只是影響因素之一。技術發展、監管環境、機構採用等都同樣重要。\n\n最後，記住分散投資的重要性。不管你多看好加密貨幣，都不應該把全部資金投入其中。合理的投資組合應該包括股票、債券、房地產等不同資產類別。\n\n聯準會的這次降息提醒我們，金融市場從來不是單向的。即使是好消息，也可能因為市場預期和複雜的經濟因素而產生意想不到的結果。重要的是保持理性，不要被情緒主導投資決策。\n\n下次聽到聯準會降息的消息時，記得問自己：市場是否已經提前反映了這個預期？還有什麼其他因素可能影響投資？這樣的思考方式，不管是投資加密貨幣還是其他資產，都會讓你成為更聰明的投資人。"
    }
  },
  "metadata": {
    "translation_status": {
      "source_language": "zh-TW",
      "source_reviewed": true,
      "translated_to": [],
      "rejection": {
        "rejected": true,
        "reason": "講太多股價、幣價波動的事情，很老生常談也沒有知識點畢竟我們不能預測走勢很老生常談也沒有知識點畢竟我們不能預測走勢。不要 market-timing 的內容，但如果你教一些美聯儲的知識讓我們當作談資就可以",
        "reviewer": "david",
        "timestamp": "2025-06-29T02:26:23.642Z"
      }
    },
    "tts": {
      "zh-TW": {
        "status": "pending",
        "audio_url": null,
        "voice_config": {
          "languageCode": "cmn-TW",
          "name": "cmn-TW-Wavenet-A"
        }
      }
    },
    "created_at": "2024-12-29T03:00:00Z",
    "updated_at": "2024-12-29T03:00:00Z"
  }
}