{
  "id": "2025-06-29-cbdc-privacy-competition",
  "date": "2025-06-29",
  "category": "macro",
  "references": [
    "https://cryptohayes.medium.com/",
    "European Central Bank Digital Euro Progress Reports",
    "Federal Reserve CBDC Research Papers",
    "Bank for International Settlements Working Papers on CBDCs"
  ],
  "languages": {
    "ja-JP": {
      "title": "中央銀行デジタル通貨のプライバシー・パラドックス：国家統制と個人の自由の究極のゲーム",
      "content": "今日は一見技術的だが、実際には私たち一人ひとりの財布とプライバシーに関わる話題について話しましょう：中央銀行デジタル通貨、つまりCBDCです。\n\n想像してみてください。あなたのすべての支出を政府がリアルタイムで見ることができるとしたら、どう感じるでしょうか？これはSF小説ではなく、私たちが向かっている現実なのです。\n\n現在、世界で100カ国以上がCBDCを研究または試験運用しており、ヨーロッパのデジタルユーロ、中国のデジタル人民元はすでに実質的なテスト段階に入っています。この背景にある動機はシンプルです：各国の中央銀行は暗号通貨の脅威を見て、同時にデジタル決済の未来も見ているのです。\n\nしかし、ここに根本的な矛盾があります。従来の現金は私たちに匿名性を与えてくれました。コーヒーを買いに行っても、政府は知りません。そして民間の暗号通貨はブロックチェーン上では透明ですが、ウォレットアドレスの背後にある身元は依然として保護されます。しかしCBDCはどうでしょうか？それは生来あなたの身元と紐づいているのです。\n\nこれが私の言う「プライバシー・パラドックス」です。中央銀行はデジタル化の効率性を求めながら、通貨システムに対する絶対的な統制も維持したいのです。結果として、完全に監視可能なデジタル通貨システムが生まれます。\n\n経済学の観点から見ると、この変化は革命的です。金融政策の伝達メカニズムは前例のないほど精密になるでしょう。中央銀行は特定のグループに直接お金を配ることができ、お金の使用期限を設定でき、さらには特定の消費行動を制限することも可能です。このようなプログラム可能な通貨は、財政政策と金融政策の境界を曖昧にします。\n\nしかしビットコインなどの分散型暗号通貨にとって、これは最良の時代かもしれません。人々がCBDCが何を意味するかを理解したとき、真のデジタルゴールド——ビットコインの価値提案はより明確になるでしょう。それは単なる投資ツールではなく、金融監視に対抗する避難所なのです。\n\n私たちは歴史的な分岐点に立っています。一方は効率的だが監視されるCBDCの世界、もう一方は自由だが複雑な分散型金融です。この両者の競争が、未来の通貨システムの方向性を決定するでしょう。\n\n個人として私たちが考えるべきことは：利便性とプライバシー、あなたはどちらを選びますか？なぜなら、この選択が私たちの今後数十年の経済生活に影響を与えるからです。"
    }
  },
  "metadata": {
    "translation_status": {
      "source_language": "zh-TW",
      "source_reviewed": true,
      "translated_to": [
        "ja-JP"
      ],
      "translated_at": "2025-06-29T07:42:07.832Z"
    },
    "tts": {
      "ja-JP": {
        "status": "completed",
        "audio_url": "https://drive.google.com/file/d/1YTHfPe6uR4uV7rOiHVGNsnw67N-jAhwM/view",
        "voice_config": {
          "languageCode": "ja-JP",
          "name": "ja-JP-Wavenet-C",
          "folderId": "1KJ1WHnnFtsafzsrWuK6S3S8Atym5lVDs"
        }
      }
    },
    "created_at": "2025-06-29T07:42:07.832Z",
    "updated_at": "2025-06-29T08:04:31.754Z"
  }
}