{
  "id": "2025-06-29-cbdc-privacy-competition",
  "date": "2025-06-29",
  "category": "macro",
  "references": [
    "https://cryptohayes.medium.com/",
    "European Central Bank Digital Euro Progress Reports",
    "Federal Reserve CBDC Research Papers",
    "Bank for International Settlements Working Papers on CBDCs"
  ],
  "languages": {
    "en-US": {
      "title": "The Privacy Paradox of Central Bank Digital Currencies: The Ultimate Game Between State Control and Individual Freedom",
      "content": "Today let's talk about a topic that seems technical, but actually concerns everyone's wallet and privacy: Central Bank Digital Currencies, or CBDCs.\n\nImagine if the government could see every single purchase you make in real time - how would that feel? This isn't science fiction, it's the reality we're heading toward.\n\nCurrently, over 100 countries worldwide are researching or piloting CBDCs. Europe's digital euro and China's digital yuan have already entered substantial testing phases. The motivation behind this is simple: central banks around the world have seen both the threat of cryptocurrencies and the future of digital payments.\n\nBut there's a fundamental contradiction here. Traditional cash gives us anonymity - when you buy a cup of coffee, the government doesn't know. While private cryptocurrencies are transparent on the blockchain, the identity behind wallet addresses can still be protected. But what about CBDCs? They're inherently tied to your identity.\n\nThis is what I call the \"privacy paradox.\" Central banks want the efficiency of digitization, but also want to maintain absolute control over the monetary system. The result is a completely monitorable digital currency system.\n\nFrom an economic perspective, this change is revolutionary. The transmission mechanism of monetary policy will become unprecedentedly precise. Central banks can directly distribute money to specific groups, set expiration dates for money, and even restrict certain spending behaviors. This programmable money blurs the lines between fiscal and monetary policy.\n\nBut for decentralized cryptocurrencies like Bitcoin, this might be the best of times. When people realize what CBDCs mean, the value proposition of true digital gold - Bitcoin - will become even clearer. It's not just an investment tool, but a safe haven against financial surveillance.\n\nWe're at a historic crossroads. On one side is the efficient but monitored CBDC world, on the other is the free but complex world of decentralized finance. The competition between these two will determine the direction of future monetary systems.\n\nAs individuals, we need to think about this: convenience or privacy - which would you choose? Because this choice will affect our economic lives for decades to come."
    }
  },
  "metadata": {
    "translation_status": {
      "source_language": "zh-TW",
      "source_reviewed": true,
      "translated_to": [
        "en-US"
      ],
      "translated_at": "2025-06-29T07:20:02.991Z"
    },
    "tts": {
      "en-US": {
        "status": "pending",
        "audio_url": null,
        "voice_config": {
          "languageCode": "en-US",
          "name": "en-US-Wavenet-D",
          "folderId": "1MkzZPY2iu09smRAwzGwXXG5_-hUDCVLw",
          "socialPrefix": "ðŸš€",
          "hookLength": 150
        }
      }
    },
    "created_at": "2025-06-29T07:20:02.993Z",
    "updated_at": "2025-06-29T07:20:02.993Z"
  }
}